ContractorName,State
Area Office Manager,AZ
Central Arizona Project,AZ
Glen Canyon Dam Field Division,AZ
Maricopa Water District,AZ
North Gila Valley Irrigation & Drainage District,AZ
Phoenix Area Office,AZ
Unit B Irrigation and Drainage District,AZ
Wellton-Mohawk Irrigation and Drainage District,AZ
Yuma Area Office,AZ
Yuma Irrigation District,AZ
Yuma Mesa Irrigation and Drainage District,AZ
Cachuma Operations and Maintenance Board,CA
California Department of Water Resources,CA
California-Great Basin Regional Office,CA
Carpinteria Valley Water District,CA
Casitas Municipal Water District,CA
Central California Area Office,CA
Coachella Valley Water District,CA
El Dorado Irrigation District,CA
Goleta Water District,CA
Imperial Irrigation District,CA
Northern California Area Office,CA
Orland Unit Water Users Association,CA
Pacific Power and Light Company (PacificCorp),CA
Palo Verde Irrigation District,CA
San Benito County Water District,CA
San Diego County Water Authority,CA
Santa Maria Valley River Water Conservation District,CA
Solano County Water Agency,CA
South-Central California Area Office,CA
Tehama-Colusa Canal Authority,CA
Bostwick Park Water Conservancy District,CO
Collbran Conservancy District,CO
Conejos Water Conservancy,CO
Crawford Water Conservancy District,CO
Curecanti Field Division,CO
Dolores Water Conservancy District,CO
Eastern Colorado Area Office,CO
Fire Mountain Canal and Reservoir Company,CO
Florida Water Conservancy District,CO
Grand Valley Water Users Association,CO
Hyrum Conservancy District,CO
Leroux Creek Water Users Association,CO
Maintenance and Replacement Association,CO
Mancos Water Conservancy District,CO
Mesa County Irrigation District,CO
Montezuma Valley Irrigation Company,CO
North Fork Water Conservancy District,CO
Northern Colorado Water Conservancy District,CO
Orchard City Irrigation District,CO
Orchard Mesa Irrigation District,CO
Palisade Irrigation District,CO
Pine River Irrigation District,CO
Rio Grande Water Users,CO
San Luis Valley Water Conservancy District,CO
Silt Water Conservancy District,CO
Tri-County Water Conservancy District,CO
Uncompahgre Valley Water Users Association,CO
Western Colorado Area Office,CO
Commissioner`s Office,DC
Boise Project Board of Control,ID
Fremont-Madison Irrigation District,ID
Lewiston Orchards Irrigation District,ID
Little Wood River Irrigation District,ID
Mann Creek Irrigation District,ID
Pacific Northwest Regional Office,ID
"Preston, Riverdale, and Mink Creek Canal Company",ID
Snake River Area Office,ID
Upper Snake Field Office,ID
Almena Irrigation District No 5,KS
Cedar Bluff Irrigation District No. 6,KS
City of Wichita,KS
Glen Elder Irrigation District,KS
Kansas-Bostwick Irrigation District No 2,KS
Kirwin Irrigation District No 1,KS
Webster Irrigation District No 4,KS
Bitter Root Project Irrigation District,MT
Bridger Valley Water Conservancy District,MT
Buffalo Rapids Irrigation District No. I,MT
Buffalo Rapids Irrigation District No. II,MT
Campbell Farming Corp. Pump Station,MT
Clark Canyon Water Supply Company,MT
Crow Irrigation Project,MT
East Bench Irrigation District,MT
Great Plains Region,MT
Greenfields Irrigation District,MT
Helena Valley Irrigation District,MT
Huntley Project Irrigation District,MT
Intake Irrigation District,MT
Lower Yellowstone Irrigation District No. 1,MT
Lower Yellowstone Irrigation District No. 2,MT
Lower Yellowstone Project Board of Control,MT
Malta Irrigation District,MT
Montana Area Office,MT
"North Helena Water Supply, Inc.",MT
Paradise Valley Irrigation District,MT
Savage Water Supply Works,MT
Toston Irrigation District,MT
Buford-Trenton Irrigation District,ND
Dakotas Area Office,ND
Dickinson-Heart River Mutual Aid Corporation,ND
East Valley Mutual Aid Co-op Association,ND
Fort Clark Irrigation District,ND
Lower Heart Irrigation Company,ND
Western Heart River Irrigation District,ND
Ainsworth Irrigation District,NE
Beerline Irrigation Canal,NE
Bostwick Irrigation District in Nebraska,NE
Browns Creek Irrigation District,NE
Central Irrigation District,NE
Chimney Rock Irrigation District,NE
Farmers Irrigation District,NE
"Frenchman Valley and H&RW Units, Joint Board",NE
Frenchman Valley Irrigation District,NE
Frenchman-Cambridge,NE
Gering Irrigation District,NE
Gering-Fort Laramie Irrigation District,NE
H&RW Irrigation District,NE
Loup River Public Power District,NE
Middle Loup Public Power and Irrigation District,NE
Mirage Flats Irrigation District,NE
Nebraska-Kansas Area Office,NE
North Loup River Public Power and Irrigation District,NE
Pathfinder Irrigation District,NE
Twin Loups Irrigation District,NE
Albuquerque Area Office,NM
Arch Hurley Conservancy District,NM
"Bureau of Reclamation, Four Corners Construction Office",NM
Carlsbad Irrigation District,NM
Elephant Butte Field Division,NM
Farmington Construction Office,NM
Fort Sumner Irrigation District,NM
Hammond Conservancy District,NM
Middle Rio Grande Conservancy District,NM
Pojoaque Valley Irrigation District,NM
Vermejo Conservancy District,NM
Boulder Canyon Operations Office,NV
Bureau of Reclamation,NV
Lahontan Basin Area Office,NV
Lower Colorado Dams Office,NV
Lower Colorado Regional Office,NV
Pershing County Water Conservation District,NV
Truckee-Carson Irrigation District,NV
U.S. Fish and Wildlife Service,NV
Washoe County Water Conservation District,NV
Arbuckle Master Conservancy District,OK
Central Oklahoma Master Conservancy District,OK
City of Altus,OK
Fort Cobb Reservoir Master Conservancy District,OK
Foss Reservoir Master Conservancy District,OK
Lugert-Altus Irrigation District,OK
McGee Creek Authority,OK
Mountain Park Master Conservancy District,OK
Baker Valley Irrigation District,OR
Bend Field Office,OR
Burnt River Irrigation District,OR
Central Oregon Irrigation District,OR
Hermiston Irrigation District,OR
Juniper Flat District Improvement Company,OR
Klamath Area Office,OR
Langell Valley Irrigation District,OR
Lower Powder River Irrigation District,OR
Medford Irrigation District,OR
North Unit Irrigation District,OR
Ochoco Irrigation District,OR
Owyhee Irrigation District,OR
Rogue River Valley Irrigation District,OR
Talent Irrigation District,OR
Umatilla Field Office,OR
Vale Oregon Irrigation District,OR
Warmsprings Irrigation District,OR
West Extension Irrigation District,OR
Angostura Irrigation District,SD
Belle Fourche Irrigation District,SD
City of Rapid City,SD
Rapid Valley Water Conservancy District,SD
Shadehill Water User District,SD
Canadian River Municipal Water Authority,TX
City of Corpus Christi,TX
Hidalgo & Cameron Counties Water Control and Improvement District No. 9,TX
La Feria Irrigation District Cameron County. No 3,TX
Oklahoma-Texas Area Office,TX
Reeves County Water Improvement District #1,TX
"San Angelo, City of",TX
Tom Green County Water Control and Improvement District No 1,TX
BIA Irrigation Department,UT
Carbon Water Conservancy District,UT
Central Utah Water Conservancy District,UT
Coordinator of the Salinity Control Program,UT
Cottonwood Creek Consolidated Irrigation Company,UT
Emery Water Conservancy District,UT
Flaming Gorge Field Division,UT
High Line Canal Company,UT
Huntington-Cleveland Irrigation Company,UT
Hyrum-South Cache Water Users Association,UT
Mapleton Irrigation Company,UT
Metropolitian Water District of Salt Lake City,UT
Moon Lake Water Users Association,UT
Newton Water Users Association,UT
Ogden River Water Users Association,UT
Power Office,UT
Provo Area Office,UT
Provo River Water Users Association,UT
Sanpete Water Conservancy District,UT
Springville Irrigation District,UT
Strawberry Water Users,UT
Uintah Water Conservancy District,UT
Upper Colorado Regional Office,UT
Weber Basin Water Conservancy District,UT
Weber River Water Users Association,UT
Columbia-Cascades Area Office,WA
Ephrata Field Office,WA
Grand Coulee Power Office,WA
Kittitas Reclamation District,WA
Okanogan Irrigation District,WA
Yakima Field Office,WA
Yakima-Tieton Irrigation District,WA
Big Horn Basin Field Office,WY
Bridger Valley Water Conservancy District,WY
Cody Canal,WY
Deaver Irrigation District,WY
Eden Valley Irrigation and Drainage District,WY
Elk Water Users Association,WY
Goshen Irrigation District,WY
Heart Mountain Irrigation District,WY
Highland Hanover Irrigation District,WY
Hill Irrigation District,WY
Lakeview Irrigation District,WY
Lingle Water Users` Association,WY
Midvale Irrigation District,WY
"North Fork Valley Ditch Company, Inc",WY
North Platte Projects Field Office,WY
Owl Creek Irrigation District,WY
Rock Ranch Irrigation Ditch Company,WY
Shoshone Irrigation District,WY
Sidon Irrigation District,WY
Willwood Irrigation District,WY
Wyoming Area Office,WY
